itemnr_new,item_new
F13_klass,Hur många gånger har du bytt skola sedan du började i grundskolans år ?
F17_klass,Hur gammal var du första gången du rökte?
F21_klass,Hur gammal var du första gången du snusade?
F37_klass,Hur många gånger har du druckit så mycket alkohol att du känt dig berusad under den senaste -veckorsperioden?
F38_klass,Hur gammal var du första gången du kände Dig berusad?
F44_klass,Hur många gånger har du sniffat/boffat den senaste den -veckorsperioden?
F45_klass,Hur gammal var du första gången du sniffade/boffade?
F50_klass,Hur många gånger har du använt narkotika (cannabis eller annan narkotika) den senaste -veckorsperioden?
F52_klass,Hur gammal var du första gången du använde narkotika?
F58_klass,Hur gammal var du första gången du skolkade en hel dag?
F78_klass,Hur gammal var du första gången du gjort något av ovanstående?
spelprobl,Haft problem av spelande (bland de som spelat enl. fråga )
f102nyckel,Elever som känner sig ganska eller mycket trygga om de går ut ensamma sent en kväll i området
f62nyckel,Elever som blivit mobbade två gånger i månaden eller oftare - bland elever som uppgett att de känt sig mobbade eller trakasserade under läsåret
F70nyckel,Elever som ofta eller ibland brukar vara på fritidsgård eller träffpunkt
F71nyckel,Elever som ofta eller ibland deltar i någon lärarledd fritidsaktivitet eller träning
f40bcnyckel,Elever som druckit alkohol hemma eller hemma hos någon annan
f100nyckel,Elever som har sovit oroligt och vaknat under natten en gång i veckan eller oftare
alkokons,Total årlig alkoholkonsumtion omräknat i procent alkohol (cl)
indexprosoc,Prosocialt index
indexinfsockontroll,Grad av informell social kontroll i bostadsområdet
indexordningsprob,Upplevelse av ordningsproblem i bostadsområdet
lag_sk103,Låg grad av social kontroll i bostadsområdet
psykhalsa,God psykisk hälsa
f65a_gammal,Vad hade du för betyg förra terminen (senast) i svenska?
f65b_gammal,Vad hade du för betyg förra terminen (senast) i engelska?
f65c_gammal,Vad hade du för betyg förra terminen (senast) i matematik?
f66v_gammal,Jag kan tänka mig att vara med i en grupp där våld är accepterat.
f86k_gammal,Hur många av dina kamrater (inom och utom skolan): Är med i en grupp där våld är accepterat?
F72_gammal,"Har Du någon gång under de senaste månaderna köpt lotter eller satsat pengar på spel? (Trisslott, bingolotto, kasinospel, poker, tips, spel på hästar eller liknande)"
CORONA_1_gammal,Relationen till min familj är...
CORONA_2_gammal,Min fritid är...
CORONA_3_gammal,Mitt umgänge med kompisar är...
CORONA_4_gammal,Min skolsituation är...
CORONA_5_gammal,Min fysiska hälsa är...
CORONA_6_gammal,Min psykiska hälsa är...
CORONA_7_gammal,Min familjs ekonomi är...
CORONA_8_gammal,Mina framtida chanser på arbetsmarknaden är...
CORONA_9_gammal,Mitt liv som helhet är...
